{
  "SalesOrder": "example_value",
  "PricingProcedureStep": "example_value",
  "PricingProcedureCounter": "example_value",
  "ConditionType": "example_value",
  "ConditionRateValue": "example_value",
  "ConditionCurrency": "example_value",
  "ConditionQuantity": "example_value",
  "ConditionQuantityUnit": "example_value",
  "ConditionCategory": "example_value",
  "ConditionIsForStatistics": true,
  "PricingScaleType": "example_value",
  "IsRelevantForAccrual": true,
  "ConditionOrigin": "example_value",
  "IsGroupCondition": "example_value",
  "ConditionAmount": "example_value",
  "TransactionCurrency": "example_value",
  "ConditionControl": "example_value",
  "ConditionInactiveReason": "example_value",
  "ConditionClass": "example_value",
  "PrcgProcedureCounterForHeader": "example_value",
  "FactorForConditionBasisValue": "example_value",
  "StructureCondition": "example_value",
  "PeriodFactorForCndnBasisValue": "example_value",
  "PricingScaleBasis": "example_value",
  "ConditionScaleBasisValue": "example_value",
  "ConditionScaleBasisUnit": "example_value",
  "ConditionScaleBasisCurrency": "example_value",
  "CndnIsRelevantForIntcoBilling": true,
  "ConditionIsManuallyChanged": true
}